{
  "basics": {
    "name": "María Camila Rincón Ayala",
    "label": "Mobile Developer",
    "image": "https://github.com/Camila237.png",
    "email": "camilarincon.02@gmail.com",
    "phone": "+57 3007254015",
    "url": "https://camila237.github.io/cv/",
    "summary": "Ingeniera de Sistemas con 5 años de experiencia en desarrollo multiplataforma (Frontend y Mobile). Me destaco por mi rápido aprendizaje, adaptabilidad y fuerte orientación al detalle en el diseño UI/UX utilizando Flutter, Angular y Android. Acostumbrada a colaborar eficazmente en equipos ágiles (Scrum), mi enfoque está en entregar resultados técnicos de alto impacto, asegurar una experiencia de usuario óptima y aportar valor a los proyectos de la empresa.",
    "location": {
      "address": "Carrera 10b # 22-44",
      "postalCode": "681002",
      "city": "Floridablanca",
      "countryCode": "CO",
      "region": "Santander"
    },
    "profiles": [
      {
        "network": "LinkedIn",
        "username": "Camila Rincón",
        "url": "https://www.linkedin.com/in/camilarincon/"
      },
      {
        "network": "GitHub",
        "username": "Camila Rincón",
        "url": "https://github.com/Camila237"
      }
    ]
  },
  "work": [
    {
      "name": "Epam",
      "position": "Experienced Developer",
      "url": "https://www.epam.com/",
      "startDate": "2025-02-07",
      "endDate": null,
      "summary": "Desarrollo y evolución de flujos de la aplicación móvil bancaria del cliente, bajo la metodología Scrum. Encargada de transformar diseños de Figma en código Flutter limpio y escalable.",
      "highlights": [
        "Implementación de flujos transaccionales escalables para el sector de banca.",
        "Desarrollo y despliegue de nuevas funcionalidades orientadas a la captación de clientes.",
        "Mejora del rendimiento de la aplicación mediante la refactorización profunda de código legado."
      ]
    },
    {
      "name": "Venko",
      "position": "Desarrolladora mobile",
      "url": "https://www.venko.co/",
      "startDate": "2021-07-05",
      "endDate": "2024-12-14",
      "summary": "Diseño y desarrollo de soluciones móviles multiplataforma para sectores de salud y productividad. Implementación de arquitecturas eficientes que combinan Flutter, desarrollo nativo (Kotlin) y visión artificial (OpenCV).",
      "highlights": [
        "Diseño y construcción desde cero de soluciones móviles para los sectores de salud y productividad.",
        "Implementación exitosa de librerías (OpenCV) para el procesamiento de imágenes."
      ]
    },
    {
      "name": "Nábica",
      "position": "Front-end Developer",
      "url": "",
      "startDate": "2021-03-03",
      "endDate": "2021-05-30",
      "summary": "Desarrollo de una landing page de alto rendimiento para un proyecto externo de la compañía. Estructuración de una interfaz web rápida, escalable y con alta fidelidad visual utilizando el framework Next.js.",
      "highlights": [
        "Maquetación e implementación frontend con alta fidelidad a los requerimientos de diseño.",
        "Optimización de tiempos de carga y estructura general utilizando Next.js."
      ]
    },
    {
      "name": "Switch AI",
      "position": "Front-end Developer",
      "url": "",
      "startDate": "2020-06-10",
      "endDate": "2021-02-28",
      "summary": "Maquetación y desarrollo front-end de la landing page corporativa principal de Switch AI. Construcción de una interfaz limpia y completamente responsive.",
      "highlights": [
        "Construcción de interfaces 100% responsive, garantizando una experiencia de navegación óptima en cualquier dispositivo.",
        "Desarrollo de código semántico, limpio y escalable."
      ]
    },
    {
      "name": "Personal",
      "position": "Full Stack Developer",
      "url": "",
      "startDate": null,
      "endDate": null,
      "summary": "Diseño y desarrollo productos propios para explorar nuevas tecnologías y experimentar con arquitecturas. He creado soluciones para educación, gestión empresarial, redes sociales, finanzas y propiedad horizontal, aplicando buenas prácticas, diseño y experiencia de usuario.",
      "highlights": [
        "Desarrollé aplicaciones multiplataforma con Flutter para diferentes verticales de negocio.",
        "Construí productos propios enfocados en educación, finanzas, productividad y propiedad horizontal.",
        "Apliqué tecnologías como GraphQL, Firebase y arquitecturas escalables para acelerar el desarrollo.",
        "Priorizé experiencia de usuario, rendimiento y mantenibilidad en cada solución."
      ]
    }
  ],
  "education": [
    {
      "institution": "Universidad Autónoma de Bucaramanga",
      "area": "Ingeniería de Sistemas",
      "paused": false,
      "studyType": "Profesional",
      "startDate": "2016-01-30",
      "endDate": "2020-12-10"
    }
  ],
  "diplomas": [],
  "certificates": [
    {
      "name": "Google Play Store Listing",
      "date": "2025-09-15",
      "validThrough": "2028-09-15",
      "issuer": "Google Play Academy",
      "url": "https://www.credential.net/0b100833-55ae-403a-bb2b-f78cb825c551#acc.ydGMQfKs"
    }
  ],
  "courses": [
    {
      "institution": "Udemy",
      "area": "Programación",
      "studyType": "Additional Training",
      "featuredCourses": [
        "Curso de desarrollo en Flutter",
        "Curso de desarrollo en Flutter Clean Architecture & Riverpod"
      ],
      "courses": [
        "Curso de desarrollo en Flutter",
        "Curso de desarrollo en Flutter Clean Architecture & Riverpod",
        "Curso de Patrones de diseño"
      ]
    }
  ],
  "featuredSkills": [
    "Flutter",
    "Kotlin",
    "Firebase",
    "AWS",
    "Angular",
    "Java"
  ],
  "skills": {
    "items": [
      {
        "name": "Flutter",
        "level": "Avanzado"
      },
      {
        "name": "Git",
        "level": "Avanzado"
      },
      {
        "name": "Firebase",
        "level": "Intermedio"
      },
      {
        "name": "Angular",
        "level": "Intermedio"
      },
      {
        "name": "AWS",
        "level": "Intermedio"
      },
      {
        "name": "Figma",
        "level": "Avanzado"
      },
      {
        "name": "Scrum",
        "level": "Avanzado"
      },
      {
        "name": "Kotlin",
        "level": "Intermedio"
      },
      {
        "name": "Java",
        "level": "Intermedio"
      },
      {
        "name": "SQL",
        "level": "Avanzado"
      },
      {
        "name": "MongoDB",
        "level": "Intermedio"
      },
      {
        "name": "Docker",
        "level": "Intermedio"
      }
    ]
  },
  "languages": [
    {
      "language": "Español",
      "fluency": "Nativo"
    },
    {
      "language": "Inglés",
      "fluency": "B2"
    }
  ],
  "hobbies": [
    "Caminar",
    "Leer",
    "Viajar"
  ],
  "projects": [
    {
      "name": "Itaú Colombia",
      "company": "Epam",
      "isActive": true,
      "description": "Desarrollo de flujos para una aplicación de banca minorista, destacando la implementación del módulo transaccional Bre-b y la creación de un nuevo sistema de ofertas orientado a la captación de nuevos clientes.",
      "highlights": [
        "Flutter",
        "AWS",
        "Angular"
      ],
      "url": null,
      "github": null
    },
    {
      "name": "Verifíquese",
      "company": "Venko",
      "isActive": true,
      "description": "App para consultar y mostrar información de una persona usando las fuentes públicas de información.",
      "highlights": [
        "Flutter",
        "Firebase",
        "Google Cloud",
        "SOLID"
      ],
      "url": null,
      "github": null
    },
    {
      "name": "Verifíquese - Backend",
      "company": "Venko",
      "isActive": true,
      "description": "App para consultar y mostrar información de una persona usando las fuentes públicas de información.",
      "highlights": [
        "Java",
        "POO",
        "Spring Boot"
      ],
      "url": null,
      "github": null
    },
    {
      "name": "Firmese",
      "company": "Venko",
      "isActive": true,
      "description": "App para firmas electrónicas.",
      "highlights": [
        "Flutter",
        "Firebase",
        "Google Cloud",
        "Next.js"
      ],
      "url": null,
      "github": null
    },
    {
      "name": "Vundo",
      "company": "Venko",
      "isActive": true,
      "description": "App para el seguimiento de hematomas y monitoreo de salud.",
      "highlights": [
        "Flutter",
        "Firebase",
        "OpenCV"
      ],
      "url": null,
      "github": null
    },
    {
      "name": "Planifiquese",
      "company": "Venko",
      "isActive": true,
      "description": "App para la gestión de trabajo y medición de tiempos, ayuda a organizar y hacer un seguimiento de su trabajo.",
      "highlights": [
        "Flutter",
        "SOLID",
        "Flutter Test",
        "Integration Test"
      ],
      "url": null,
      "github": null
    },
    {
      "name": "GoldRain",
      "company": "Venko",
      "isActive": true,
      "description": "App similar a un generador de Low Code, que permite crear apps en base a un texto usando lenguaje descriptivo.",
      "highlights": [
        "Flutter",
        "SOLID",
        "Flutter Test",
        "Integration Test"
      ],
      "url": null,
      "github": null
    },
    {
      "name": "Pet Society",
      "company": "Personal",
      "isActive": true,
      "description": "Pet Society es un proyecto que busca tener una red social en la que puedas encontrar adopciones, apareamientos, ventas, veterinaria, guías y cuidados para diferentes tipos de mascotas.",
      "highlights": [
        "Flutter",
        "Firebase",
        "MongoDB",
        "Mockoon"
      ],
      "url": null,
      "github": null
    },
    {
      "name": "Fiper",
      "company": "Personal",
      "isActive": true,